brand,nom_etablissement,source,note_brute,texte,note_std,langue,texte_propre,date,sentiment_score,sentiment_label
Huttopia,Versailles,Google Maps,,"C'était trooooop bien ! On était pas loin de Paris mais en tente c'était économique et pratique ! On a utiliser l'option bagagerie de la gare, pour profiter de la ville sans encombrements. Le camping nous avez laisser une plan et notre emplacement donc on pu s'installer de nuit. En plus monsieur Moustafa était là, c'est le Batman du camping ! Du coup l'accueil de nuit super chouette. Le lendemain, on a pu boire un café et jouer à des jeux de société dans le restaurant c'était trop bien +1 pour la demoiselle trop cool et belle avec qui j'ai papoter au bar ! L'arrêt du RER est vraiment à 9 minutes à patoune et 12 min pour l'arrêt des bus de nuit, donc vous pouvez vraiment vous amusez jusqu'au bout de la nuit dans al capitale et rentrée dans un havre de paix juste après. Les gens de la ville de Porchefontaine, connaissent tous le camping, si vous êtes perdu ils vont vous guider !!",3.0,fr,"C'était trooooop bien ! On était pas loin de Paris mais en tente c'était économique et pratique ! On a utiliser l'option bagagerie de la gare, pour profiter de la ville sans encombrements. Le camping nous avez laisser une plan et notre emplacement donc on pu s'installer de nuit. En plus monsieur Moustafa était là, c'est le Batman du camping ! Du coup l'accueil de nuit super chouette. Le lendemain, on a pu boire un café et jouer à des jeux de société dans le restaurant c'était trop bien +1 pour la demoiselle trop cool et belle avec qui j'ai papoter au bar ! L'arrêt du RER est vraiment à 9 minutes à patoune et 12 min pour l'arrêt des bus de nuit, donc vous pouvez vraiment vous amusez jusqu'au bout de la nuit dans al capitale et rentrée dans un havre de paix juste après. Les gens de la ville de Porchefontaine, connaissent tous le camping, si vous êtes perdu ils vont vous guider !!",,0.16402343750000004,Positif
Huttopia,Versailles,Google Maps,,"Un superbe camping très propre, une super équipe, piscine et jeux au top, service pain génial, sécurité toute la nuit, proche des bus pour aller à Paris ! Nous recommandons vivement et reviendrons !",4.0,fr,"Un superbe camping très propre, une super équipe, piscine et jeux au top, service pain génial, sécurité toute la nuit, proche des bus pour aller à Paris ! Nous recommandons vivement et reviendrons !",,0.6633333333333334,Positif
Huttopia,Versailles,Google Maps,,"Emplacement idéal, sanitaires propres, loin de l'image qu'on peut se faire des camping, agréablement surpris. Le personnel est charmant, et le gérant est top !!",4.0,fr,"Emplacement idéal, sanitaires propres, loin de l'image qu'on peut se faire des camping, agréablement surpris. Le personnel est charmant, et le gérant est top !!",,0.5178750000000001,Positif
Huttopia,Versailles,Google Maps,,"Endroit très calme, ombragé très propre.la piscine est un plus qui a permis de se détendre après une journée a Paris.Un vrai dépaysement ! Et le personnel d'une gentillesse et d'une très grande efficacité ! Je recommande vivement ce camping !",3.0,fr,"Endroit très calme, ombragé très propre.la piscine est un plus qui a permis de se détendre après une journée a Paris.Un vrai dépaysement ! Et le personnel d'une gentillesse et d'une très grande efficacité ! Je recommande vivement ce camping !",,0.2053125,Positif
Huttopia,Versailles,Google Maps,,"Nous avons choisi ce camping sur recommandation et nous avons été satisfaits.  Avoir une piscine intérieure était très bien pour les jours de pluie, mais l'absence d'un dressing, de toilettes et d'une douche à côté de la piscine était un inconvénient. Le sol des emplacements pour tentes n'est pas plat mais très en pente. La propreté des toilettes et des salles de bain était bonne. Un lit parapluie et une chaise haute pour bébé peuvent être commandés à l'avance, ce qui est très bien. Certaines zones ont une table fixe, nous ne l'avons pas remarqué lors de la réservation, nous nous sommes retrouvés sans table, ceux qui le souhaitent doivent y faire attention. Le lave-linge coûte 4€, 1€ supplémentaire pour la lessive, le sèche-linge coûte 4€, j'ai trouvé ça cher.",3.0,fr,"Nous avons choisi ce camping sur recommandation et nous avons été satisfaits.  Avoir une piscine intérieure était très bien pour les jours de pluie, mais l'absence d'un dressing, de toilettes et d'une douche à côté de la piscine était un inconvénient. Le sol des emplacements pour tentes n'est pas plat mais très en pente. La propreté des toilettes et des salles de bain était bonne. Un lit parapluie et une chaise haute pour bébé peuvent être commandés à l'avance, ce qui est très bien. Certaines zones ont une table fixe, nous ne l'avons pas remarqué lors de la réservation, nous nous sommes retrouvés sans table, ceux qui le souhaitent doivent y faire attention. Le lave-linge coûte 4€, 1€ supplémentaire pour la lessive, le sèche-linge coûte 4€, j'ai trouvé ça cher.",,0.12615384615384617,Neutre
Huttopia,Versailles,Google Maps,,Excellent séjour en famille au calme tout en étant en ville. La cabane est propre et accueillante. Le poêle est très agréable à utiliser avec la météo pluvieuse. Camping idéalement situé pour visiter le château de Versailles et visiter Paris (30 minutes). L'équipe d'accueil est sympathique et efficace. Je recommande +++,4.0,fr,Excellent séjour en famille au calme tout en étant en ville. La cabane est propre et accueillante. Le poêle est très agréable à utiliser avec la météo pluvieuse. Camping idéalement situé pour visiter le château de Versailles et visiter Paris (30 minutes). L'équipe d'accueil est sympathique et efficace. Je recommande +++,,0.42444444444444446,Positif
Huttopia,Versailles,Google Maps,,"Camping proche du centre de Versailles, le RER est à 10 mn à pieds pour se rendre à Paris. Le service de bus se situe à 5 mn à pieds. Le service accueil et le bar sont tenus par une équipe de jeunes très sympathique. Les emplacements sont grands et en paliers si bien que l'on se sent bien sans être les uns collés aux autres. Je recommande.",3.0,fr,"Camping proche du centre de Versailles, le RER est à 10 mn à pieds pour se rendre à Paris. Le service de bus se situe à 5 mn à pieds. Le service accueil et le bar sont tenus par une équipe de jeunes très sympathique. Les emplacements sont grands et en paliers si bien que l'on se sent bien sans être les uns collés aux autres. Je recommande.",,0.22666666666666668,Positif
Huttopia,Versailles,Google Maps,,"Le camping en lui même est très bien. Très arboré, la piscine est agréable, même par temps de pluie car couverte. Le bar pizzeria est un vrai plus, le cadre y est chaleureux. Les employés sont très accueillants et les sanitaires propres. J'enlève néanmoins une étoile pour le prix. pour un petit emplacement cyclo on me demandait 50 euros au départ dont 20 euros de frais de réservation. Un geste a été fait sur cela mais cela reste à 30 euros , prix que je n'ai jamais vu dans un autre camping même très bien situé.",3.0,fr,"Le camping en lui même est très bien. Très arboré, la piscine est agréable, même par temps de pluie car couverte. Le bar pizzeria est un vrai plus, le cadre y est chaleureux. Les employés sont très accueillants et les sanitaires propres. J'enlève néanmoins une étoile pour le prix. pour un petit emplacement cyclo on me demandait 50 euros au départ dont 20 euros de frais de réservation. Un geste a été fait sur cela mais cela reste à 30 euros , prix que je n'ai jamais vu dans un autre camping même très bien situé.",,0.176,Positif
Huttopia,Versailles,Google Maps,,"Cadre superbe, une forêt pour promener au pied du camping, mais des tarifs parisiens au si bien pour l’emplacement que pour la restauration. Cher pour ce que c’est.",3.0,fr,"Cadre superbe, une forêt pour promener au pied du camping, mais des tarifs parisiens au si bien pour l’emplacement que pour la restauration. Cher pour ce que c’est.",,0.1975,Positif
Huttopia,Versailles,Google Maps,,"Camping très agréable , en pleine nature à 20min à pied  du château de Versailles .Les gares toutes proche vous emmènes à Paris en moins d'une demi heure , vraiment un emplacement de choix pour ce camping . Avec des emplacements ombragés et quasi de niveau , ce fut pour nous un agréable séjour ,. Le service boulangerie et le pizzas le vendredi soir  furent vraiment un plus pour nous .Je vous recommande vivement ce camping si vous voulez visiter le château ou la capitale .",4.0,fr,"Camping très agréable , en pleine nature à 20min à pied  du château de Versailles .Les gares toutes proche vous emmènes à Paris en moins d'une demi heure , vraiment un emplacement de choix pour ce camping . Avec des emplacements ombragés et quasi de niveau , ce fut pour nous un agréable séjour ,. Le service boulangerie et le pizzas le vendredi soir  furent vraiment un plus pour nous .Je vous recommande vivement ce camping si vous voulez visiter le château ou la capitale .",,0.29416666666666674,Positif
Huttopia,Versailles,Google Maps,,"En camping car. Très bien placé pour les visites. Personnel charmant. Je retire un étoile pour la douche, au choix : froide avec pression ou tiède en fin filet 🤔",3.0,fr,"En camping car. Très bien placé pour les visites. Personnel charmant. Je retire un étoile pour la douche, au choix : froide avec pression ou tiède en fin filet 🤔",,0.03500000000000001,Neutre
Huttopia,Versailles,Google Maps,,"Ça pourrait être un beau camping nature mais les emplacements sont décevants pas entretenus. Le personnel de l'accueil très agréable ce qui n'est pas le cas de la restauration très méprisant et pas correct vis à vis de la clientèle. Un 10 sur 10 pour les sanitaires qui sont toujours très propres. Quand à la piscine inaccessible, aucune règle, vu le prix un surveillant de baignade serait nécessaire (slip sous les shorts de bain) . Nous sommes venus 2 fois mais nous ne reviendrons pas.",3.0,fr,"Ça pourrait être un beau camping nature mais les emplacements sont décevants pas entretenus. Le personnel de l'accueil très agréable ce qui n'est pas le cas de la restauration très méprisant et pas correct vis à vis de la clientèle. Un 10 sur 10 pour les sanitaires qui sont toujours très propres. Quand à la piscine inaccessible, aucune règle, vu le prix un surveillant de baignade serait nécessaire (slip sous les shorts de bain) . Nous sommes venus 2 fois mais nous ne reviendrons pas.",,0.1811111111111111,Positif
Huttopia,Versailles,Google Maps,,S'il n'y avait pas eu les JO à Paris je n'y aurais jamais posé ma caravane. Et ce serait l'unique raison pour un retour. C'est le camping avec la nuitée la plus chère et ça fait le taf sans plus. Sanitaires pratiques et propres. Bon snack. Très pauvre en animation.,3.0,fr,S'il n'y avait pas eu les JO à Paris je n'y aurais jamais posé ma caravane. Et ce serait l'unique raison pour un retour. C'est le camping avec la nuitée la plus chère et ça fait le taf sans plus. Sanitaires pratiques et propres. Bon snack. Très pauvre en animation.,,0.06525,Neutre
Huttopia,Versailles,Google Maps,,"Endroit agréable et très bien situé à deux pas d'un RER et collé à une forêt, le lieu est assez calme. La cabane que nous avons eu était très fonctionnelle et adaptée pour une famille de 4. Petit bémol pour la literie assez ferme, l'isolation phonique plutot faible dans un chalet en bois et le voisinage qui peut être bruyant de temps en temps mais la nuit ça restait très calme dans l'ensemble.",3.0,fr,"Endroit agréable et très bien situé à deux pas d'un RER et collé à une forêt, le lieu est assez calme. La cabane que nous avons eu était très fonctionnelle et adaptée pour une famille de 4. Petit bémol pour la literie assez ferme, l'isolation phonique plutot faible dans un chalet en bois et le voisinage qui peut être bruyant de temps en temps mais la nuit ça restait très calme dans l'ensemble.",,0.11,Neutre
Huttopia,Versailles,Google Maps,,"Nous avons passé un très bon séjour, nos enfants ont adorés camping agréable propre , bel espace de jeu et mise à disposition de jeux extérieur (badminton, ping pong, pétanque …) La proximité avec le rer c permet de rejoindre rapidement la capital et son centre Piscine agréable et chauffé Équipe souriante",4.0,fr,"Nous avons passé un très bon séjour, nos enfants ont adorés camping agréable propre , bel espace de jeu et mise à disposition de jeux extérieur (badminton, ping pong, pétanque …) La proximité avec le rer c permet de rejoindre rapidement la capital et son centre Piscine agréable et chauffé Équipe souriante",,0.4255555555555556,Positif
Huttopia,Versailles,Google Maps,,Super camping. Proche de Paris et tellement dépaysant. Nous y retournerons avec grand plaisir.,4.0,fr,Super camping. Proche de Paris et tellement dépaysant. Nous y retournerons avec grand plaisir.,,0.294,Positif
Huttopia,Versailles,Google Maps,,"J’ai été logée dans ce camping pour un Congrès, le lieu est bucolique, les tentes très jolies et bien aménagées, confortables. J’aurais été plus rassurée avec deux cadenas à ma tente pour les deux cotés.",4.0,fr,"J’ai été logée dans ce camping pour un Congrès, le lieu est bucolique, les tentes très jolies et bien aménagées, confortables. J’aurais été plus rassurée avec deux cadenas à ma tente pour les deux cotés.",,0.3625,Positif
Huttopia,Versailles,Google Maps,,"Camping très bien situé pour découvrir Versailles et Paris. Proximité de nombreux services et transports facilement accessibles. Le cadre est verdoyant et apaisant (appréciable après une journée dans la foule notamment). Le personnel est souriant, de bon conseil et disponible. La tente trapeur est fonctionnelle et confortable. Bref nous reviendrons.",3.0,fr,"Camping très bien situé pour découvrir Versailles et Paris. Proximité de nombreux services et transports facilement accessibles. Le cadre est verdoyant et apaisant (appréciable après une journée dans la foule notamment). Le personnel est souriant, de bon conseil et disponible. La tente trapeur est fonctionnelle et confortable. Bref nous reviendrons.",,0.1990909090909091,Positif
Huttopia,Versailles,Google Maps,3.0,"Très agréable séjour de 4 jours. Très bonne accueil lors de notre arrivé, et toujours bien renseigné tout au long du séjour. Nous avons mangé une pizza le dernier soir qui était très bonne. La propreté des sanitaires sont bien suivie et propre (juste sale par des gens irrespectueux). Les emplacements sont propres et spacieux, cependant pas assez intime ,manque de brises vues naturel ou artificiel. Je recommande ce camping. Merci à tout le personnel.",3.0,fr,"Très agréable séjour de 4 jours. Très bonne accueil lors de notre arrivé, et toujours bien renseigné tout au long du séjour. Nous avons mangé une pizza le dernier soir qui était très bonne. La propreté des sanitaires sont bien suivie et propre (juste sale par des gens irrespectueux). Les emplacements sont propres et spacieux, cependant pas assez intime ,manque de brises vues naturel ou artificiel. Je recommande ce camping. Merci à tout le personnel.",,0.19090909090909092,Positif
Huttopia,Versailles,Google Maps,,"L'emplacement est sale et en pente, le camping car s'enfonce dans le sable. Nous avons voulu utiliser l'aire de vidange qui a l'air propre -tout a bien fonctionné sauf au moment de repartir car la pente est trop importante et nous avons accroché notre marche-pied que nous avons abîmé. Il serait pertinent de revoir l'accessibilité à l'aire de vidange car nous avons dû ensuite repartir en marche arrière sur plus de 100 m. Les sanitaires sont très propres et très agréables. Nous n'avons pas bien profité de la piscine car malgré les interdictions de plonger et de sauter, les enfants pourtant sur la surveillance d'un adulte ne se sont pas gênés ! Peut-être qu'il serait nécessaire de mettre une personne à la surveillance de la piscine. On s'attendait à mieux, vu le prix élevé de l'emplacement.",3.0,fr,"L'emplacement est sale et en pente, le camping car s'enfonce dans le sable. Nous avons voulu utiliser l'aire de vidange qui a l'air propre -tout a bien fonctionné sauf au moment de repartir car la pente est trop importante et nous avons accroché notre marche-pied que nous avons abîmé. Il serait pertinent de revoir l'accessibilité à l'aire de vidange car nous avons dû ensuite repartir en marche arrière sur plus de 100 m. Les sanitaires sont très propres et très agréables. Nous n'avons pas bien profité de la piscine car malgré les interdictions de plonger et de sauter, les enfants pourtant sur la surveillance d'un adulte ne se sont pas gênés ! Peut-être qu'il serait nécessaire de mettre une personne à la surveillance de la piscine. On s'attendait à mieux, vu le prix élevé de l'emplacement.",,0.2205769230769231,Positif
Huttopia,Versailles,Google Maps,,"Camping idéalement situé pour visiter Paris (13 min à pied du RER), bon accueil, chalet bien équipé, literie confortable. Je recommande ce camping.",3.0,fr,"Camping idéalement situé pour visiter Paris (13 min à pied du RER), bon accueil, chalet bien équipé, literie confortable. Je recommande ce camping.",,0.21999999999999997,Positif
Huttopia,Versailles,Google Maps,,J'ai passé 3 jours dans un mobil-home ici c'était un peu sale mais ça a été mais franchement je mettrai une note de 4 étoiles sur 5 malheureusement vu que c'est pas un très grand fan de ça parce que je suis pas un grand fan de la nature mais vu que moi je suis pas trop méchante je mets pas 3 ni de mais je mets 4 au moins,3.0,fr,J'ai passé 3 jours dans un mobil-home ici c'était un peu sale mais ça a été mais franchement je mettrai une note de 4 étoiles sur 5 malheureusement vu que c'est pas un très grand fan de ça parce que je suis pas un grand fan de la nature mais vu que moi je suis pas trop méchante je mets pas 3 ni de mais je mets 4 au moins,,0.06964285714285715,Neutre
Huttopia,Versailles,Google Maps,,"Séjour de 4 nuits du 8 au 11 mai. Chalet très confortable, cadre merveilleux en pleine forêt, équipe très sympathique souriante et très réactive. L’espace piscine est très agréable. Les enfants se sont régalés. Environnement calme, idéal pour se mettre au vert. Nous reviendrons 🌺",4.0,fr,"Séjour de 4 nuits du 8 au 11 mai. Chalet très confortable, cadre merveilleux en pleine forêt, équipe très sympathique souriante et très réactive. L’espace piscine est très agréable. Les enfants se sont régalés. Environnement calme, idéal pour se mettre au vert. Nous reviendrons 🌺",,0.5469999999999999,Positif
Huttopia,Versailles,Google Maps,,"Tarifs prohibitifs et prestations lamentables : les réservations ne sont pas prises en compte, les emplacements « grand confort » sont étriqués et pour certains quasi-inaccessibles, la direction est sourde à toute réclamation, bref la situation de monopole et l’absence de concurrence leur permet d’afficher le mépris des camping caristes. Et chaque année cette situation empire hélas. Dommage…",3.0,fr,"Tarifs prohibitifs et prestations lamentables : les réservations ne sont pas prises en compte, les emplacements « grand confort » sont étriqués et pour certains quasi-inaccessibles, la direction est sourde à toute réclamation, bref la situation de monopole et l’absence de concurrence leur permet d’afficher le mépris des camping caristes. Et chaque année cette situation empire hélas. Dommage…",,-0.0075,Neutre
Huttopia,Versailles,Google Maps,,"Réservation obligatoire 🫩 On a fait demi-tour 🤗  On a un camping car de 7,50m avec une remorque moto, ça passe mais c’est chaud 🥵",3.0,fr,"Réservation obligatoire 🫩 On a fait demi-tour 🤗  On a un camping car de 7,50m avec une remorque moto, ça passe mais c’est chaud 🥵",,0.024999999999999994,Neutre
Huttopia,Versailles,Google Maps,,"Très bon séjour, adresse à garder !|Les draps et serviettes sont fournis, fait rare pour un camping. Personnel au top et d'une gentillesse.|Camping calme, personnel à l'écoute.|Nous y avons séjourner pour un motif professionnel et je recommande !",4.0,fr,"Très bon séjour, adresse à garder !|Les draps et serviettes sont fournis, fait rare pour un camping. Personnel au top et d'une gentillesse.|Camping calme, personnel à l'écoute.|Nous y avons séjourner pour un motif professionnel et je recommande !",,0.2814285714285714,Positif
Huttopia,Versailles,Google Maps,,"Nous avons séjourné à 5 adultes dans une cabane en bois avec mezzanine, que du bois à l'intérieur, c'était très cozy.Nous avions de l'espace et la terrasse est très agréable. La piscine et transats au top.Situation très nature et calme, très appréciable au retour d'une journée mouvementée dans Paris. A 5 min à pieds vous trouverez une super boulangerie-pâtisserie + le mercredi et le samedi un petit marché avec de bons producteurs et à 10 min à pieds, la gare RER C qui vous amène à la station champs de mars Tour eiffel en 20 min, c'est hyper pratique. Non loin de la boulangerie vous avez l'arrêt de bus où vous pouvez prendre le 6202 qui vous amènera en 20 min au chateau de versailles, très pratique. Au camping, il y a un dépôt de pain et viennoiseries chaque matin c'est appréciable. Accueil super, très à l'écoute et serviable. A l'intérieur de la cabane, draps, couettes et oreillers fournis c'est TOP et la literie est bonne.Le chauffage a bien fonctionné, personne a eu froid. Je recommande ce camping pour un retour aux sources et je recommande la cabane en bois qui est hyper chaleureuse.Merci pour ce super séjour.",3.0,fr,"Nous avons séjourné à 5 adultes dans une cabane en bois avec mezzanine, que du bois à l'intérieur, c'était très cozy.Nous avions de l'espace et la terrasse est très agréable. La piscine et transats au top.Situation très nature et calme, très appréciable au retour d'une journée mouvementée dans Paris. A 5 min à pieds vous trouverez une super boulangerie-pâtisserie + le mercredi et le samedi un petit marché avec de bons producteurs et à 10 min à pieds, la gare RER C qui vous amène à la station champs de mars Tour eiffel en 20 min, c'est hyper pratique. Non loin de la boulangerie vous avez l'arrêt de bus où vous pouvez prendre le 6202 qui vous amènera en 20 min au chateau de versailles, très pratique. Au camping, il y a un dépôt de pain et viennoiseries chaque matin c'est appréciable. Accueil super, très à l'écoute et serviable. A l'intérieur de la cabane, draps, couettes et oreillers fournis c'est TOP et la literie est bonne.Le chauffage a bien fonctionné, personne a eu froid. Je recommande ce camping pour un retour aux sources et je recommande la cabane en bois qui est hyper chaleureuse.Merci pour ce super séjour.",,0.24714285714285716,Positif
Huttopia,Versailles,Google Maps,,"Difficile de trouver plus mauvais rapport qualité/ prix ! Prix exorbitants, toile d'araignée, poussière, lampes grillées,chauffage en option,bref la totale .Le seul intérêt c'est sa relative proximité avec le château et la Capitale. N'oublions pas les emplacements minus, et défoncés. A fuir (si vous le pouvez)",3.0,fr,"Difficile de trouver plus mauvais rapport qualité/ prix ! Prix exorbitants, toile d'araignée, poussière, lampes grillées,chauffage en option,bref la totale .Le seul intérêt c'est sa relative proximité avec le château et la Capitale. N'oublions pas les emplacements minus, et défoncés. A fuir (si vous le pouvez)",,-0.13624999999999998,Neutre
Huttopia,Versailles,Google Maps,,"Séjour en famille, 4 nuits en van en avril pour visiter Versailles et Paris. Première déception la taille et l état de l emplacement. Nous avons dû débourser 34€ supp pour avoir un emplacement plat! Et sur lequel je pouvais garer mon van et sortir mon auvent! La nature est tres présente! même trop! J ai vu camping car neuf s'abimer avec une branche en empruntant le chemin de service! Mais vous ne trouverez pas d herbe!! Que du sable et des pierres. Ne chercher pas l intimité, rien ne vous cache, les sanitaires sont aux 4 vents sans chauffage!!par 10 degrés!!bref merci Huttopia de nous rappeler le pire! Une grosse majorité d étrangers, notre enfant c est bien ennuyé. J ai beaucoup apprécié la suffisance de l accueil, on s'en bien qu ils sont pas là pour être ici. En 35 ans de camping et de van, je vous assure que je n' ai jamais été aussi pressé de partir et soyez rassuré je ne reviendrai pas.",3.0,fr,"Séjour en famille, 4 nuits en van en avril pour visiter Versailles et Paris. Première déception la taille et l état de l emplacement. Nous avons dû débourser 34€ supp pour avoir un emplacement plat! Et sur lequel je pouvais garer mon van et sortir mon auvent! La nature est tres présente! même trop! J ai vu camping car neuf s'abimer avec une branche en empruntant le chemin de service! Mais vous ne trouverez pas d herbe!! Que du sable et des pierres. Ne chercher pas l intimité, rien ne vous cache, les sanitaires sont aux 4 vents sans chauffage!!par 10 degrés!!bref merci Huttopia de nous rappeler le pire! Une grosse majorité d étrangers, notre enfant c est bien ennuyé. J ai beaucoup apprécié la suffisance de l accueil, on s'en bien qu ils sont pas là pour être ici. En 35 ans de camping et de van, je vous assure que je n' ai jamais été aussi pressé de partir et soyez rassuré je ne reviendrai pas.",,-0.05439338235294118,Neutre
