brand,nom_etablissement,source,note_brute,texte,note_std,langue,texte_propre,date,sentiment_score,sentiment_label
Huttopia,Lac_Serre_Poncon,Google Maps,,"Une expérience tout à fait décevante. Un emplacement pour tente facturé 1000 €, situé sur un terrain mal entretenu, et un bungalow à 2500 € qui ne comprend même pas le nécessaire en literie ni les ustensiles de cuisine. Quant à la propreté, elle laisse grandement à désirer. Les sanitaires sont extrêmement sales et le personnel semble démotivé, donnant l'impression d'être contraint de travailler dans ces conditions. De plus, des frais de 21,50 € sont appliqués pour une prise électrique, alors qu'il aurait été préférable d'indiquer lors de la réservation qu'un adaptateur était nécessaire. Cette structure apparaît avant tout comme une entreprise cherchant uniquement le profit. Je suis soulagé d’être parti aujourd’hui et je ne reviendrai jamais. Autant installer une tente dans mon propre jardin, ce serait nettement plus agréable. Ce furent les pires vacances que j’aie connues.",3.0,fr,"Une expérience tout à fait décevante. Un emplacement pour tente facturé 1000 €, situé sur un terrain mal entretenu, et un bungalow à 2500 € qui ne comprend même pas le nécessaire en literie ni les ustensiles de cuisine. Quant à la propreté, elle laisse grandement à désirer. Les sanitaires sont extrêmement sales et le personnel semble démotivé, donnant l'impression d'être contraint de travailler dans ces conditions. De plus, des frais de 21,50 € sont appliqués pour une prise électrique, alors qu'il aurait été préférable d'indiquer lors de la réservation qu'un adaptateur était nécessaire. Cette structure apparaît avant tout comme une entreprise cherchant uniquement le profit. Je suis soulagé d’être parti aujourd’hui et je ne reviendrai jamais. Autant installer une tente dans mon propre jardin, ce serait nettement plus agréable. Ce furent les pires vacances que j’aie connues.",,0.13111111111111112,Neutre
Huttopia,Lac_Serre_Poncon,Google Maps,,"Nous avions réservé un emplacement (2 adultes et 2 enfants) pour un séjour de 3 nuits. Le soir de notre arrivée, nous avons eu un orage suivi de pluie assez abondante, et cela devait continué tout le long du séjour. L'emplacement devenant boueux, et activité annulée, le lendemain nous avons décidé malheureusement d'anticipé notre départ. Nous sommes restés seulement 1 nuit. Le camping n'est pas très bien entretenu, sanitaires très sales, eau froide pour faire la vaisselle... Echange fait par mail, avec une personne pas du tout empathique (Aurore). Si nous avions regardé les avis, on ne serait pas venu.",3.0,fr,"Nous avions réservé un emplacement (2 adultes et 2 enfants) pour un séjour de 3 nuits. Le soir de notre arrivée, nous avons eu un orage suivi de pluie assez abondante, et cela devait continué tout le long du séjour. L'emplacement devenant boueux, et activité annulée, le lendemain nous avons décidé malheureusement d'anticipé notre départ. Nous sommes restés seulement 1 nuit. Le camping n'est pas très bien entretenu, sanitaires très sales, eau froide pour faire la vaisselle... Echange fait par mail, avec une personne pas du tout empathique (Aurore). Si nous avions regardé les avis, on ne serait pas venu.",,-0.08076923076923077,Neutre
Huttopia,Lac_Serre_Poncon,Google Maps,,"Un superbe camping, au calme avec une vue incroyable. Les animations et services proposés sont de qualité et très loin de club vacances bruyants. Ici le calme est respecté. Les activitès orientées nature, dètente sont parfaites pour occuper toute la famille. Les sanitaires sont nettoyès très règulièrement et propres ! Seul petit bèmol : le nombre de toilettes est insuffisant. Sinon tout est parfait !",4.0,fr,"Un superbe camping, au calme avec une vue incroyable. Les animations et services proposés sont de qualité et très loin de club vacances bruyants. Ici le calme est respecté. Les activitès orientées nature, dètente sont parfaites pour occuper toute la famille. Les sanitaires sont nettoyès très règulièrement et propres ! Seul petit bèmol : le nombre de toilettes est insuffisant. Sinon tout est parfait !",,0.31640625,Positif
Huttopia,Lac_Serre_Poncon,Google Maps,,Camping perdu au milieu de la nature. Ideal pour se ressourcer. Piscine agréable à côté de la plage du lac.  Supérette a côté proximité ainsi qu'une base nautique.  Dommage que peux d'activités proposées en fin de saison.,3.0,fr,Camping perdu au milieu de la nature. Ideal pour se ressourcer. Piscine agréable à côté de la plage du lac.  Supérette a côté proximité ainsi qu'une base nautique.  Dommage que peux d'activités proposées en fin de saison.,,0.1285714285714286,Neutre
Huttopia,Lac_Serre_Poncon,Google Maps,,"Endroit splendide, malheureusement les emplacements proposés par le camping ne répondent pas aux attentes. Absence manifeste d’arbres, dans un endroit pourtant où la nature proposait initialement une belle végétation, avec emplacements superposés. À éviter en cas d’enfants notamment en bas âges. Les emplacements alternatifs proposés étaient semblables. Dommage.",3.0,fr,"Endroit splendide, malheureusement les emplacements proposés par le camping ne répondent pas aux attentes. Absence manifeste d’arbres, dans un endroit pourtant où la nature proposait initialement une belle végétation, avec emplacements superposés. À éviter en cas d’enfants notamment en bas âges. Les emplacements alternatifs proposés étaient semblables. Dommage.",,0.1,Neutre
Huttopia,Lac_Serre_Poncon,Google Maps,,"Cadre magique juste sur le lac, petit havre de paix. Les bungalows sont bien agencés et le personnel est super sympa ! Et pleins d’activités géniales. J’y retournerais c'est sûr !!",4.0,fr,"Cadre magique juste sur le lac, petit havre de paix. Les bungalows sont bien agencés et le personnel est super sympa ! Et pleins d’activités géniales. J’y retournerais c'est sûr !!",,0.35225,Positif
Huttopia,Lac_Serre_Poncon,Google Maps,,"Camping dans un lieu paradisiaque vu sur le lac, bungalow très propre et bien agencé activité possible à côté. Endroit calme et reposant ! Je recommande !!",3.0,fr,"Camping dans un lieu paradisiaque vu sur le lac, bungalow très propre et bien agencé activité possible à côté. Endroit calme et reposant ! Je recommande !!",,0.1975,Positif
Huttopia,Lac_Serre_Poncon,Google Maps,,"Avis mitigé Séjour de 2 semaines. Endroit au top , les pieds dans l’eau , paysage magnifique . Les tentes aménagées sont bien espacées et bien agencées . Mauvaise surprise à l’arrivée de ne pas pouvoir amener la voiture à la tente pour décharger les bagages . Au parking il devrait y avoir des charriotes pour mettre nos bagages mais ils sont utilisés par les Belges et hollandais qui les conservent à leur tente pour promener leurs enfants ou mettre le paddle . Nous avons alerté l’accueil qui n’a jamais fait le nécessaire pour les récupérer . Nous avons dû décharger toute notre voiture et coffre de toit à la force de nos bras sur 500 mètres en plusieurs allers-retours. Il est Difficile de se rendre aux sanitaires avec un talus à monter très raide . Notre bloc sanitaire comporte seulement 3 douches et 3 toilettes , difficile à l’heure de pointe . Les odeurs nauséabondes toute la journée et nuit gâchent un peu l’environnement agréable . Il manque des animations le soir pour aller profiter de la terrasse qui est très agréable. La piscine est très bien ( mis à part que le règlement ne soit pas respecté et que le sol soit très glissant ) autant que le fait d’être au pied du lac pour nager et faire du paddle. Le personnel de l’épicerie et des bars à la plage est très sympathique. Le personnel du camping très jeune n’est au courant de rien et est nonchalant. Beaucoup trop de belges et hollandais qui ont une façon de vivre totalement différente.  Ils sont sans gène et ne respectent aucune règle. Nous avons passés globalement de bonnes vacances  mais quelques points sont quand même à revoir pour améliorer l’ensemble.",3.0,fr,"Avis mitigé Séjour de 2 semaines. Endroit au top , les pieds dans l’eau , paysage magnifique . Les tentes aménagées sont bien espacées et bien agencées . Mauvaise surprise à l’arrivée de ne pas pouvoir amener la voiture à la tente pour décharger les bagages . Au parking il devrait y avoir des charriotes pour mettre nos bagages mais ils sont utilisés par les Belges et hollandais qui les conservent à leur tente pour promener leurs enfants ou mettre le paddle . Nous avons alerté l’accueil qui n’a jamais fait le nécessaire pour les récupérer . Nous avons dû décharger toute notre voiture et coffre de toit à la force de nos bras sur 500 mètres en plusieurs allers-retours. Il est Difficile de se rendre aux sanitaires avec un talus à monter très raide . Notre bloc sanitaire comporte seulement 3 douches et 3 toilettes , difficile à l’heure de pointe . Les odeurs nauséabondes toute la journée et nuit gâchent un peu l’environnement agréable . Il manque des animations le soir pour aller profiter de la terrasse qui est très agréable. La piscine est très bien ( mis à part que le règlement ne soit pas respecté et que le sol soit très glissant ) autant que le fait d’être au pied du lac pour nager et faire du paddle. Le personnel de l’épicerie et des bars à la plage est très sympathique. Le personnel du camping très jeune n’est au courant de rien et est nonchalant. Beaucoup trop de belges et hollandais qui ont une façon de vivre totalement différente.  Ils sont sans gène et ne respectent aucune règle. Nous avons passés globalement de bonnes vacances  mais quelques points sont quand même à revoir pour améliorer l’ensemble.",,0.17103448275862068,Positif
Huttopia,Lac_Serre_Poncon,Google Maps,,"Expérience décevante, les activités ne sont pas adaptée à mon fils de 6 ans. Donc pour compenser il y a à l'accueil des jeux de société ou raquette de ping pong. La piscine est fermée depuis 3 jours a cause des bactéries dans l'eau mais il n'y a pas d'activité à proposer si ce n'est que de louer à un prestataire extérieur au camping des activités nautique. Déménagement en début de soirée suite à la colonisation du chalet par des fourmis (dans mon cas) et par des loirs dans d'autres cas. La plage du camping n'est pas entretenu (terrain marécageux, rondin de bois sur la plage, mauvaises herbes). Aucune compassion pour les vacanciers à la suite de ces désagréments. Vous savez a quoi vous en tenir. Sinon le lac est magnifique et les environs du lac majestueux. Les activités en dehors du camping sont géniaux. Donc in fine, nous payons le chalet.  Pour résumer, faire du camping sauvage ou venir chez Huttopia, il n'y a que 1000€ de différence.",3.0,fr,"Expérience décevante, les activités ne sont pas adaptée à mon fils de 6 ans. Donc pour compenser il y a à l'accueil des jeux de société ou raquette de ping pong. La piscine est fermée depuis 3 jours a cause des bactéries dans l'eau mais il n'y a pas d'activité à proposer si ce n'est que de louer à un prestataire extérieur au camping des activités nautique. Déménagement en début de soirée suite à la colonisation du chalet par des fourmis (dans mon cas) et par des loirs dans d'autres cas. La plage du camping n'est pas entretenu (terrain marécageux, rondin de bois sur la plage, mauvaises herbes). Aucune compassion pour les vacanciers à la suite de ces désagréments. Vous savez a quoi vous en tenir. Sinon le lac est magnifique et les environs du lac majestueux. Les activités en dehors du camping sont géniaux. Donc in fine, nous payons le chalet.  Pour résumer, faire du camping sauvage ou venir chez Huttopia, il n'y a que 1000€ de différence.",,0.17181818181818184,Positif
Huttopia,Lac_Serre_Poncon,Google Maps,,"Super camping Familial, au calme avec une vue imprenable sur le lac turquoise et la montagne. L’implantation des infrastructures qui se fondent dans la nature, une équipe très présente et agréable et une petite terrasse pour boire un coup et manger une pizza avec une vue imprenable. Une piscine accueillante. Un séjour en paix et au calme où chacun semble respectueux du site et des autres. Je recommande et je reviendrai !!",4.0,fr,"Super camping Familial, au calme avec une vue imprenable sur le lac turquoise et la montagne. L’implantation des infrastructures qui se fondent dans la nature, une équipe très présente et agréable et une petite terrasse pour boire un coup et manger une pizza avec une vue imprenable. Une piscine accueillante. Un séjour en paix et au calme où chacun semble respectueux du site et des autres. Je recommande et je reviendrai !!",,0.2765909090909091,Positif
Huttopia,Lac_Serre_Poncon,Google Maps,,"Nous avons séjourné dans un chalet Montana. L’emplacement est vraiment agréable, en hauteur face au lac, a quelques minutes a pied ,par un sentier descendant ou montant , le long d 'un petit torrent ombragé tres frais , des aires de jeux et de la piscine. Le cadre est verdoyant, avec beaucoup d’arbres : parfait pour se détendre ou pique-niquer à l’ombre. Les animations du soir  pour les enfants sont également de très bonne qualité, ce qui a beaucoup plu à mes enfants.  En revanche, plusieurs points sont à améliorer : – La qualité de construction du chalet est moyenne. Le lit superposé des enfants n’est pas chanfreiné, ce qui peut causer des échardes, comme c’est aussi le cas autour de la piscine. – Le matériel fourni est vieillissant : parasol cassé dès la première utilisation, cafetière en plastique peu pratique, ventilateur aliexpress premier prix ? casseroles qui dégagent une forte odeur de plastique à la cuisson du fait des poignées . – L’isolation phonique entre les chambres est quasi inexistante. Pas idéal pour préserver un peu d’intimité. – Il n’y a pas de lave-linge dans la zone des chalets (secteur 220), ce qui oblige à marcher environ 20 minutes pour en trouver un. – Enfin, le bar n’ouvre qu’à 14h, ce qui est assez étonnant quand on aimerait simplement prendre un café le matin.  Un bon potentiel, mais certains aspects mériteraient clairement d’être revus pour améliorer le confort.",4.0,fr,"Nous avons séjourné dans un chalet Montana. L’emplacement est vraiment agréable, en hauteur face au lac, a quelques minutes a pied ,par un sentier descendant ou montant , le long d 'un petit torrent ombragé tres frais , des aires de jeux et de la piscine. Le cadre est verdoyant, avec beaucoup d’arbres : parfait pour se détendre ou pique-niquer à l’ombre. Les animations du soir  pour les enfants sont également de très bonne qualité, ce qui a beaucoup plu à mes enfants.  En revanche, plusieurs points sont à améliorer : – La qualité de construction du chalet est moyenne. Le lit superposé des enfants n’est pas chanfreiné, ce qui peut causer des échardes, comme c’est aussi le cas autour de la piscine. – Le matériel fourni est vieillissant : parasol cassé dès la première utilisation, cafetière en plastique peu pratique, ventilateur aliexpress premier prix ? casseroles qui dégagent une forte odeur de plastique à la cuisson du fait des poignées . – L’isolation phonique entre les chambres est quasi inexistante. Pas idéal pour préserver un peu d’intimité. – Il n’y a pas de lave-linge dans la zone des chalets (secteur 220), ce qui oblige à marcher environ 20 minutes pour en trouver un. – Enfin, le bar n’ouvre qu’à 14h, ce qui est assez étonnant quand on aimerait simplement prendre un café le matin.  Un bon potentiel, mais certains aspects mériteraient clairement d’être revus pour améliorer le confort.",,0.2607407407407407,Positif
Huttopia,Lac_Serre_Poncon,Google Maps,,"Mes meilleures vacances dans un camping. Cet endroit est unique, tout est hyper propre et bien organisé. Plein d’activités autour. Vue imprenable sur le lac.",4.0,fr,"Mes meilleures vacances dans un camping. Cet endroit est unique, tout est hyper propre et bien organisé. Plein d’activités autour. Vue imprenable sur le lac.",,0.31142857142857144,Positif
Huttopia,Lac_Serre_Poncon,Google Maps,,"Camping moyen Dès l’arrivée, c’est le désordre total.Il n’y a même pas de magasin sur place pour faire des courses de base, ce qui est très contraignant.  J’ai passé 45 minutes à choisir un emplacement précis, pour qu’au final, on m’en attribue un complètement différent, sans aucune explication. En plus, il faut marcher énormément pour accéder aux sanitaires ou à l’accueil, ce qui devient vite pénible, surtout avec des enfants ou du matériel.  Vraiment une déception pour 400€ les 3 nuits 😩",3.0,fr,"Camping moyen Dès l’arrivée, c’est le désordre total.Il n’y a même pas de magasin sur place pour faire des courses de base, ce qui est très contraignant.  J’ai passé 45 minutes à choisir un emplacement précis, pour qu’au final, on m’en attribue un complètement différent, sans aucune explication. En plus, il faut marcher énormément pour accéder aux sanitaires ou à l’accueil, ce qui devient vite pénible, surtout avec des enfants ou du matériel.  Vraiment une déception pour 400€ les 3 nuits 😩",,0.0,Neutre
Huttopia,Lac_Serre_Poncon,Google Maps,,"Très grand emplacement verdoyant, sanitaires propres. Très belles et rudes balades à faire à pied . Amabilité du personnel.on recommande🤗🤗🤗",4.0,fr,"Très grand emplacement verdoyant, sanitaires propres. Très belles et rudes balades à faire à pied . Amabilité du personnel.on recommande🤗🤗🤗",,0.4325,Positif
Huttopia,Lac_Serre_Poncon,Google Maps,,"Camping pas adapté aux enfants de moins de 6ans. Absence de garde corps sur les chalets avec un vide à 60cm devant la terrasse. Bois non chanfreiné ni poncé: nous avons passé la semaine à enlever des echardes aux doigts des enfants. Chalet très mal isolé phoniquement parlant. Présence importante de Cornouiller sanguin, dont les baies sont toxiques pour le système digestif, à portée de mains de partout. Ce qui nous a value un appel au centre anti poison. J'entends le côté nature, nous venons de savoie et habitons en forêt, mais c'est tout de même un lieu accueillant du public et c'est assez light en terme de sécurité. Point positif pour l'air de jeux, bar/restauration, accueil, piscine et lac dans le camping. Équipe fatigué car fin de saison mais très aimable donc nickel.",3.0,fr,"Camping pas adapté aux enfants de moins de 6ans. Absence de garde corps sur les chalets avec un vide à 60cm devant la terrasse. Bois non chanfreiné ni poncé: nous avons passé la semaine à enlever des echardes aux doigts des enfants. Chalet très mal isolé phoniquement parlant. Présence importante de Cornouiller sanguin, dont les baies sont toxiques pour le système digestif, à portée de mains de partout. Ce qui nous a value un appel au centre anti poison. J'entends le côté nature, nous venons de savoie et habitons en forêt, mais c'est tout de même un lieu accueillant du public et c'est assez light en terme de sécurité. Point positif pour l'air de jeux, bar/restauration, accueil, piscine et lac dans le camping. Équipe fatigué car fin de saison mais très aimable donc nickel.",,0.01800000000000001,Neutre
Huttopia,Lac_Serre_Poncon,Google Maps,,"Emplacement très grand , vue sur le lac , plage public en bas du camping . Personnel très accueillant. Petit bémol , nombreux sanitaires condamnés lors de notre passage . Jolie piscine . Très calme en juin . Épicerie sur place avec pain et viennoiseries.",4.0,fr,"Emplacement très grand , vue sur le lac , plage public en bas du camping . Personnel très accueillant. Petit bémol , nombreux sanitaires condamnés lors de notre passage . Jolie piscine . Très calme en juin . Épicerie sur place avec pain et viennoiseries.",,0.25111111111111106,Positif
Huttopia,Lac_Serre_Poncon,Google Maps,,"Camping très agréable, avec accès à toutes les activités du lac. Coin restaurant très chill avec vue sur le lac, piscine très sympa en hauteur du lac. Personnel très accueillant, Nous recommandons",4.0,fr,"Camping très agréable, avec accès à toutes les activités du lac. Coin restaurant très chill avec vue sur le lac, piscine très sympa en hauteur du lac. Personnel très accueillant, Nous recommandons",,0.41333333333333333,Positif
Huttopia,Lac_Serre_Poncon,Google Maps,,"Camping très bien localisé avec un bel espace restaurant/bar/piscine. Par contre gros soucis dans le logement, notamment dans les tentes canadiennes, toutes les nuit nous étions dérangés par des loirs qui fouillaient les poubelles, faisaient tomber la vaisselle avec en prime des excréments et de l'urine partout sur nos affaires. Quand j'ai évoqué le problème on m'a dit qu'en effet c'était une zone avec beaucoup de loirs qui sont une espèce protégé. On m'a proposé un mobil-home à l'extérieur du camping et très éloigné mais pas vraiment d'autres solutions... C'est dommage car ça nous a vraiment gâché le séjour alors que je pense qu'en repensant l'aménagement et la structure des tentes, le problème pourrait être évité... Ou au moins informer les voyageurs car avec un petit bébé de 4 mois et sachant que les loirs sont porteurs de bactéries et de maladies, j'aurais annulé ma venue si j'avais su, pour ne pas prendre de risques.",3.0,fr,"Camping très bien localisé avec un bel espace restaurant/bar/piscine. Par contre gros soucis dans le logement, notamment dans les tentes canadiennes, toutes les nuit nous étions dérangés par des loirs qui fouillaient les poubelles, faisaient tomber la vaisselle avec en prime des excréments et de l'urine partout sur nos affaires. Quand j'ai évoqué le problème on m'a dit qu'en effet c'était une zone avec beaucoup de loirs qui sont une espèce protégé. On m'a proposé un mobil-home à l'extérieur du camping et très éloigné mais pas vraiment d'autres solutions... C'est dommage car ça nous a vraiment gâché le séjour alors que je pense qu'en repensant l'aménagement et la structure des tentes, le problème pourrait être évité... Ou au moins informer les voyageurs car avec un petit bébé de 4 mois et sachant que les loirs sont porteurs de bactéries et de maladies, j'aurais annulé ma venue si j'avais su, pour ne pas prendre de risques.",,0.04541666666666667,Neutre
Huttopia,Lac_Serre_Poncon,Google Maps,,"Nous avons réservé pour l'ouverture et nous avons eu la très bonne surprise d'être surclassé dans un chalet bois.  Contrairement à d'autres, ce camping est très grand (19 hectares) et reparti en plusieurs espaces très bien agencés.  Les chalets sont tous orientés pour qu'aucune terrasse ne se fassent face.  Bien équipé et fonctionnel : c'est parfait !",3.0,fr,"Nous avons réservé pour l'ouverture et nous avons eu la très bonne surprise d'être surclassé dans un chalet bois.  Contrairement à d'autres, ce camping est très grand (19 hectares) et reparti en plusieurs espaces très bien agencés.  Les chalets sont tous orientés pour qu'aucune terrasse ne se fassent face.  Bien équipé et fonctionnel : c'est parfait !",,0.21545454545454545,Positif
Huttopia,Lac_Serre_Poncon,Google Maps,,"Très beau camping, au calme et au pied du lac. Les emplacements de camping sont spacieux et agréables, l’équipe est très sympathique, les sanitaires propres et les éléments de divertissement proposés sur places parfaits ! Merci pour ce séjour, je recommande :)",4.0,fr,"Très beau camping, au calme et au pied du lac. Les emplacements de camping sont spacieux et agréables, l’équipe est très sympathique, les sanitaires propres et les éléments de divertissement proposés sur places parfaits ! Merci pour ce séjour, je recommande :)",,0.5389999999999999,Positif
Huttopia,Lac_Serre_Poncon,Google Maps,,Superbe ! Nous sommes dans la partie emplacement à l'écart du camping plus traditionnel mais avec accès aux restaurants et aux plages. On peut y faire de nombreuses activités nautiques et du parapente. Sanitaires propres et accueil très agréable,4.0,fr,Superbe ! Nous sommes dans la partie emplacement à l'écart du camping plus traditionnel mais avec accès aux restaurants et aux plages. On peut y faire de nombreuses activités nautiques et du parapente. Sanitaires propres et accueil très agréable,,0.38833333333333336,Positif
Huttopia,Lac_Serre_Poncon,Google Maps,,"Super séjour malgré les températures fraîches pour la saison. Nous avons été surclassés dans un logement avec chauffage et heureusement ! Le personnel est parfait : souriant, disponible, à l'écoute... Super camping familial et proche de la nature.",4.0,fr,"Super séjour malgré les températures fraîches pour la saison. Nous avons été surclassés dans un logement avec chauffage et heureusement ! Le personnel est parfait : souriant, disponible, à l'écoute... Super camping familial et proche de la nature.",,0.3829166666666666,Positif
Huttopia,Lac_Serre_Poncon,Google Maps,,Camping idyllique dans une cadre magnifique. Magnifique piscine avec vue sur le lac et les montagnes. L'aquapark du lac a regalé les enfants toute la semaine. A faire sans hésiter.,4.0,fr,Camping idyllique dans une cadre magnifique. Magnifique piscine avec vue sur le lac et les montagnes. L'aquapark du lac a regalé les enfants toute la semaine. A faire sans hésiter.,,0.7400000000000001,Positif
